[
  {
    "Name": "Aqueous Aluminum Sulfate",
    "PrimaryInput": "Aluminum Sulfate",
    "Inputs": {
      "Aluminum Sulfate": 1,
      "Water": 1
    },
    "Outputs": {
      "Aqueous Aluminum Sulfate": 1
    },
    "Catalysts": {},
    "Electrolysis": false,
    "Temperature": 0,
    "MaxTemperature": null,
    "ChangeInTemperature": 0,
    "Probability": 0
  }
]