[
  {
    "Name": "Bauxite Decomposition",
    "PrimaryInput": "Bauxite",
    "Inputs": {
      "Bauxite": 1
    },
    "Outputs": {
      "Aluminum Oxyhydroxide": 1,
      "Steam": 1
    },
    "Catalysts": {},
    "Electrolysis": false,
    "Temperature": 450,
    "MaxTemperature": null,
    "ChangeInTemperature": 0,
    "Probability": 0
  }
]