[
  {
    "Name": "Pyrite Decomposition",
    "PrimaryInput": "Pyrite",
    "Inputs": {
      "Pyrite": 2
    },
    "Outputs": {
      "Rust": 1,
      "Sulfur Dioxide Gas": 1
    },
    "Catalysts": {},
    "Electrolysis": false,
    "Temperature": 700,
    "MaxTemperature": null,
    "ChangeInTemperature": 0,
    "Probability": 0
  }
]