[
  {
    "Name": "Dysprosium Oxide + Hydrofluoric Acid Gas",
    "PrimaryInput": "Dysprosium Oxide",
    "Inputs": {
      "Dysprosium Oxide": 1,
      "Hydrofluoric Acid Gas": 6
    },
    "Outputs": {
      "Dysprosium Fluoride": 2,
      "Steam": 3
    },
    "Catalysts": {},
    "Electrolysis": false,
    "Temperature": 0,
    "MaxTemperature": null,
    "ChangeInTemperature": 0,
    "Probability": 0
  }
]