[
  {
    "Name": "Titanium Dioxide Oxygenation",
    "PrimaryInput": "Titanium Dioxide",
    "Inputs": {
      "Titanium Dioxide": 1
    },
    "Outputs": {
      "Dititanium Trioxide": 1
    },
    "Catalysts": {
      "Carbon": 2
    },
    "Electrolysis": false,
    "Temperature": 1400,
    "MaxTemperature": null,
    "ChangeInTemperature": 0,
    "Probability": 0
  }
]