[
  {
    "Name": "Sulfuric Acid + Zinc Oxide",
    "PrimaryInput": "Zinc Oxide",
    "Inputs": {
      "Zinc Oxide": 1,
      "Sulfuric Acid": 1
    },
    "Outputs": {
      "Zinc Sulfate": 1,
      "Water": 1
    },
    "Catalysts": {},
    "Electrolysis": false,
    "Temperature": null,
    "MaxTemperature": null,
    "ChangeInTemperature": 0,
    "Probability": 0
  }
]