[
  {
    "Name": "Aqueous Zinc Sulfate + Aqueous Lye",
    "PrimaryInput": "Aqueous Zinc Sulfate",
    "Inputs": {
      "Aqueous Zinc Sulfate": 1,
      "Aqueous Lye": 2
    },
    "Outputs": {
      "Zinc Hydroxide": 1,
      "Aqueous Sodium Sulfate": 1
    },
    "Catalysts": {},
    "Electrolysis": false,
    "Temperature": 273,
    "MaxTemperature": null,
    "ChangeInTemperature": 0,
    "Probability": 0
  }
]