[
  {
    "Name": "Naphtha Hydrotreating",
    "PrimaryInput": "Straight-Run Naphtha",
    "Inputs": {
      "Straight-Run Naphtha": 5,
      "Hydrogen Gas": 2
    },
    "Outputs": {
      "Hydrotreated Naphtha": 5,
      "Naphtha Hydrotreater Sour Gas": 1
    },
    "Catalysts": {},
    "Electrolysis": false,
    "Temperature": 330,
    "MaxTemperature": 400,
    "ChangeInTemperature": 0,
    "Probability": 0
  }
]
