[
  {
    "Name": "Ammonia Gas + Hydrogen Iodide Gas",
    "PrimaryInput": "Hydrogen Iodide Gas",
    "Inputs": {
      "Hydrogen Iodide Gas": 1,
      "Ammonia Gas": 1
    },
    "Outputs": {
      "Ammonium Iodide": 1
    },
    "Catalysts": {},
    "Electrolysis": false,
    "Temperature": null,
    "MaxTemperature": null,
    "ChangeInTemperature": 0,
    "Probability": 0
  }
]