[
  {
    "Name": "Aqueous Copper Sulfate + Aqueous Sodium Carbonate",
    "PrimaryInput": "Aqueous Copper(II) Sulfate",
    "Inputs": {
      "Aqueous Copper(II) Sulfate": 1,
      "Aqueous Sodium Carbonate": 1
    },
    "Outputs": {
      "Aqueous Sodium Sulfate": 1,
      "Copper Carbonate": 1
    },
    "Catalysts": {},
    "Electrolysis": false,
    "Temperature": 298,
    "MaxTemperature": null,
    "ChangeInTemperature": 0,
    "Probability": 0
  }
]