[
  {
    "Name": "Kerosene Merox Sweetening",
    "PrimaryInput": "Kerosene",
    "Inputs": {
      "Kerosene": 5,
      "Oxygen Gas": 1
    },
    "Outputs": {
      "Sweetened Kerosene": 5,
      "Dimethyl Disulfide": 1
    },
    "Catalysts": {},
    "Electrolysis": false,
    "Temperature": 40,
    "MaxTemperature": 80,
    "ChangeInTemperature": 0,
    "Probability": 0
  }
]
