[
  {
    "Name": "Hydrofluoric Acid Dissolves Aluminum",
    "PrimaryInput": "Hydrofluoric Acid",
    "Inputs": {
      "Hydrofluoric Acid": 3,
      "Aluminum": 1
    },
    "Outputs": {
      "Aluminum Fluoride": 1,
      "Hydrogen Gas": 1
    },
    "Catalysts": {},
    "Electrolysis": false,
    "Temperature": null,
    "MaxTemperature": null,
    "ChangeInTemperature": 0,
    "Probability": 0
  }
]