[
  {
    "Name": "Limestone + Hydrochloric Acid",
    "PrimaryInput": "Limestone",
    "Inputs": {
      "Limestone": 1,
      "Hydrochloric Acid": 2
    },
    "Outputs": {
      "Calcium Chloride": 1,
      "Carbon Dioxide": 1,
      "Water": 1
    },
    "Catalysts": {},
    "Electrolysis": false,
    "Temperature": null,
    "MaxTemperature": null,
    "ChangeInTemperature": 0,
    "Probability": 0
  }
]